{
  "candidat_id": "marine-le-pen",
  "theme_id": "terrorisme",
  "statut": "sourcee",
  "maj_le": "2026-10-17",
  "commit_ref": "",
  "alerte_maj": false,
  "position_actuelle": {
    "synthese": "La candidate propose l'éradication des « idéologies islamistes » et de « l'ensemble de leurs réseaux » du territoire national.",
    "mesure_phare": "Éradication des réseaux « islamistes »",
    "type_mesure": "orientee",
    "source": {
      "url_live": "https://rassemblementnational.fr/22-mesures",
      "url_archive": "https://web.archive.org/web/20261003214140/https://rassemblementnational.fr/22-mesures",
      "titre": "Les 22 mesures du Rassemblement National — mesure 2",
      "date_verification": "2026-10-17",
      "verbatim": "Éradiquer les idéologies islamistes et l'ensemble de leurs réseaux du territoire national."
    }
  },
  "fil_du_temps": [],
  "actes_passes": []
}
