{
  "candidat_id": "marine-le-pen",
  "theme_id": "environnement",
  "statut": "sourcee",
  "maj_le": "2026-10-17",
  "commit_ref": "",
  "alerte_maj": false,
  "position_actuelle": {
    "synthese": "La candidate propose l'indépendance énergétique par la relance du nucléaire, de l'hydroélectricité et de l'hydrogène, l'arrêt des nouveaux parcs éoliens avec démantèlement progressif des parcs existants, et la sortie du marché européen de l'électricité.",
    "mesure_phare": "Relance nucléaire/hydro/hydrogène — arrêt des éoliennes — sortie du marché européen de l'électricité",
    "type_mesure": "orientee",
    "source": {
      "url_live": "https://rassemblementnational.fr/22-mesures",
      "url_archive": "https://web.archive.org/web/20261003214140/https://rassemblementnational.fr/22-mesures",
      "titre": "Les 22 mesures du Rassemblement National — mesure 12",
      "date_verification": "2026-10-17",
      "verbatim": "Arrêter les projets éoliens et démanteler progressivement les parcs existants. — Relancer la filière nucléaire, hydroélectrique et investir dans la filière hydrogène. — Sortir du marché européen de l'électricité pour retrouver des prix décents."
    }
  },
  "fil_du_temps": [],
  "actes_passes": []
}
