{
  "candidat_id": "gabriel-attal",
  "theme_id": "environnement",
  "statut": "sourcee",
  "maj_le": "2026-10-17",
  "commit_ref": "",
  "alerte_maj": false,
  "position_actuelle": {
    "synthese": "Le candidat fait de la « dette écologique » l'une des deux dettes à résorber : tripler le rythme de réduction des émissions (de 1,8% à 5% par an jusqu'en 2030), sortir de la dépendance aux fossiles (56% de la consommation finale), rénovation thermique massive, véhicule électrique accessible et industrie décarbonée.",
    "mesure_phare": "Tripler le rythme de réduction des émissions : 1,8% → 5%/an — sortie de la dépendance fossile",
    "type_mesure": "chiffree",
    "source": {
      "url_live": "https://attalpresident.fr/programme/dette-ecologique",
      "url_archive": "https://web.archive.org/",
      "titre": "Dette écologique — attalpresident.fr",
      "date_verification": "2026-10-17",
      "verbatim": "Je veux une France qui continue à montrer la voie : une rénovation thermique massive pour que chaque foyer soit protégé des canicules comme du froid, l'électrique développé massivement et accessible à tous, une industrie décarbonée qui crée les emplois de demain sur notre territoire."
    }
  },
  "fil_du_temps": [],
  "actes_passes": []
}
