{
  "candidat_id": "edouard-philippe",
  "theme_id": "delinquance",
  "statut": "sourcee",
  "maj_le": "2026-10-17",
  "commit_ref": "",
  "alerte_maj": false,
  "position_actuelle": {
    "synthese": "Le candidat propose un arsenal pénal renforcé : « courtes peines » dès la première infraction, peines planchers pour les infractions graves, suppression du juge d'application des peines et pouvoir de sanction pénale pour les maires. Il propose aussi un « état d'urgence narco » contre le narcotrafic.",
    "mesure_phare": "Peines planchers + suppression du juge d'application des peines + « état d'urgence narco »",
    "type_mesure": "orientee",
    "source": {
      "url_live": "https://www.edouardphilippe.fr/priorites/pour-une-france-plus-sure",
      "url_archive": "https://web.archive.org/",
      "titre": "Pour une France plus sûre — Rétablir l'autorité, la fermeté et l'efficacité de la Justice",
      "date_verification": "2026-10-17",
      "verbatim": "Mettre en place des courtes peines, en s'inspirant des pays du Nord qui condamnent dès la première infraction à une peine courte et dissuasive plutôt que d'enfermer trop tard et trop longtemps."
    }
  },
  "fil_du_temps": [],
  "actes_passes": []
}
