{
  "candidat_id": "edouard-philippe",
  "theme_id": "emploi-chomage",
  "statut": "sourcee",
  "maj_le": "2026-10-17",
  "commit_ref": "",
  "alerte_maj": false,
  "position_actuelle": {
    "synthese": "Le candidat propose de réduire à 12 mois maximum la durée d'indemnisation chômage pour les moins de 50 ans (contre 18 mois), d'instaurer 3 jours de carence sur les arrêts maladie dans le privé comme le public, et une période incompressible de 3 à 6 mois entre arrêt maladie et rupture conventionnelle.",
    "mesure_phare": "Indemnisation chômage max 12 mois (<50 ans) — 3 jours de carence arrêts maladie",
    "type_mesure": "chiffree",
    "source": {
      "url_live": "https://www.edouardphilippe.fr/priorites/pour-une-france-plus-prospere",
      "url_archive": "https://web.archive.org/web/20261016072257/https://www.edouardphilippe.fr/priorites/pour-une-france-plus-prospere",
      "titre": "Pour une France plus prospère — Assurer l'avenir des générations futures",
      "date_verification": "2026-10-17",
      "verbatim": "Réduire à 12 mois maximum la durée d'indemnisation chômage pour les moins de 50 ans, contre 18 mois aujourd'hui, sur le modèle allemand."
    }
  },
  "fil_du_temps": [],
  "actes_passes": [
    {
      "date": "2017-09",
      "acte": "Réforme du code du travail par cinq ordonnances : compte de prévention, paritarisme, fusion des institutions représentatives du personnel — acte fondateur de son gouvernement",
      "mandat": "Premier ministre (2017-2020)",
      "source_url": "https://www.info.gouv.fr/actualite/edouard-philippe-les-francais-ont-envie-d-une-transformation-en-profondeur"
    }
  ]
}
