{
  "candidat_id": "edouard-philippe",
  "theme_id": "pouvoir-achat",
  "statut": "sourcee",
  "maj_le": "2026-10-17",
  "commit_ref": "",
  "alerte_maj": true,
  "position_actuelle": {
    "synthese": "Le candidat propose de rééquilibrer le financement du modèle social « pour qu'il ne repose plus uniquement sur le travail » et augmenter le salaire net des actifs : heures supplémentaires exonérées de cotisations et d'impôt (environ 1 000 €/an au SMIC pour deux heures de plus par semaine), zéro cotisation patronale au-delà de la 37e heure, sortie des 35 heures décidée en entreprise, et un « pacte fiscal » de 50 Md€ de baisses d'impôts de production.",
    "mesure_phare": "Travail supplémentaire exonéré (~1 000 €/an au SMIC) — zéro cotisation patronale au-delà de la 37e h — pacte fiscal 50 Md€",
    "type_mesure": "chiffree",
    "source": {
      "url_live": "https://www.edouardphilippe.fr/priorites/pour-une-france-plus-prospere",
      "url_archive": "https://web.archive.org/web/20261016072257/https://www.edouardphilippe.fr/priorites/pour-une-france-plus-prospere",
      "titre": "Pour une France plus prospère — Alléger la charge sur les actifs",
      "date_verification": "2026-10-17",
      "verbatim": "Faire que le travail supplémentaire paie : lorsqu'une entreprise décide, après discussion interne, de travailler plus longtemps, exonérer ces heures de cotisations sociales et d'impôt sur le revenu, soit environ 1 000 € de plus par an au SMIC pour deux heures de plus par semaine."
    }
  },
  "fil_du_temps": [],
  "actes_passes": []
}
